[
  {"id":"java_basis_001","type":"single","category":"Java基础","subCategory":"语法","stem":"Java 中方法参数传递本质是？","options":["引用传递","值传递","按需传递","地址传递"],"answers":["值传递"],"explanation":"Java 始终是值传递；对象参数传递的是引用副本。","difficulty":1,"tags":["参数传递"],"source":{"repo":"Snailclimb/JavaGuide","path":"docs/java/basis/why-there-only-value-passing-in-java.md"}},
  {"id":"java_basis_002","type":"multi","category":"Java基础","subCategory":"面向对象","stem":"下面哪些属于 Java 面向对象三大特征？","options":["封装","继承","多态","函数式"],"answers":["封装","继承","多态"],"explanation":"经典三大特征：封装、继承、多态。","difficulty":1,"tags":["OOP"],"source":{"repo":"Snailclimb/JavaGuide","path":"docs/java/basis/java-basic-questions-01.md"}},
  {"id":"collection_001","type":"single","category":"集合","subCategory":"HashMap","stem":"JDK8 中 HashMap 冲突较严重时可能转为？","options":["队列","红黑树","跳表","二叉堆"],"answers":["红黑树"],"explanation":"链表长度超过阈值会树化为红黑树。","difficulty":2,"tags":["HashMap"],"source":{"repo":"Snailclimb/JavaGuide","path":"docs/java/collection/hashmap-source-code.md"}},
  {"id":"concurrent_001","type":"single","category":"并发","subCategory":"锁","stem":"CAS 的核心思想是？","options":["悲观加锁","比较并交换","批量提交","线程休眠"],"answers":["比较并交换"],"explanation":"CAS 即 Compare-And-Swap。","difficulty":2,"tags":["CAS"],"source":{"repo":"Snailclimb/JavaGuide","path":"docs/java/concurrent/cas.md"}},
  {"id":"concurrent_002","type":"blank","category":"并发","subCategory":"JMM","stem":"JMM 中保证可见性的关键关键字之一是 ____。","answers":["volatile"],"explanation":"volatile 可保证可见性并禁止部分重排序。","difficulty":2,"tags":["JMM"],"source":{"repo":"Snailclimb/JavaGuide","path":"docs/java/concurrent/jmm.md"}},
  {"id":"jvm_001","type":"single","category":"JVM","subCategory":"内存区域","stem":"以下哪项通常是线程共享区域？","options":["虚拟机栈","程序计数器","堆","本地方法栈"],"answers":["堆"],"explanation":"堆是线程共享，栈和程序计数器是线程私有。","difficulty":2,"tags":["内存区域"],"source":{"repo":"Snailclimb/JavaGuide","path":"docs/java/jvm/memory-area.md"}},
  {"id":"jvm_002","type":"multi","category":"JVM","subCategory":"GC","stem":"常见垃圾回收算法包括？","options":["标记-清除","复制","标记-整理","哈夫曼编码"],"answers":["标记-清除","复制","标记-整理"],"explanation":"GC 常见算法不包括哈夫曼编码。","difficulty":2,"tags":["GC"],"source":{"repo":"Snailclimb/JavaGuide","path":"docs/java/jvm/jvm-garbage-collection.md"}},
  {"id":"mysql_001","type":"single","category":"MySQL","subCategory":"事务","stem":"InnoDB 默认事务隔离级别是？","options":["读未提交","读已提交","可重复读","串行化"],"answers":["可重复读"],"explanation":"InnoDB 默认可重复读。","difficulty":2,"tags":["事务隔离"],"source":{"repo":"Snailclimb/JavaGuide","path":"docs/database/mysql/transaction-isolation-level.md"}},
  {"id":"mysql_002","type":"multi","category":"MySQL","subCategory":"日志","stem":"MySQL 常见三大日志包括？","options":["binlog","redo log","undo log","event log"],"answers":["binlog","redo log","undo log"],"explanation":"三大日志为 binlog/redo/undo。","difficulty":3,"tags":["日志"],"source":{"repo":"Snailclimb/JavaGuide","path":"docs/database/mysql/mysql-logs.md"}},
  {"id":"redis_001","type":"single","category":"Redis","subCategory":"数据结构","stem":"Redis 中用于计数场景最常见的类型是？","options":["String","List","Set","ZSet"],"answers":["String"],"explanation":"计数通常基于 String 的 INCR。","difficulty":1,"tags":["数据结构"],"source":{"repo":"Snailclimb/JavaGuide","path":"docs/database/redis/redis-data-structures-01.md"}},
  {"id":"redis_002","type":"blank","category":"Redis","subCategory":"持久化","stem":"Redis 两种主要持久化机制是 RDB 和 ____。","answers":["AOF"],"explanation":"Redis 持久化主要为 RDB 与 AOF。","difficulty":1,"tags":["持久化"],"source":{"repo":"Snailclimb/JavaGuide","path":"docs/database/redis/redis-persistence.md"}},
  {"id":"network_001","type":"single","category":"计算机网络","subCategory":"TCP","stem":"TCP 建立连接需要几次握手？","options":["2","3","4","5"],"answers":["3"],"explanation":"TCP 建连是三次握手。","difficulty":1,"tags":["TCP"],"source":{"repo":"Snailclimb/JavaGuide","path":"docs/cs-basics/network/tcp-connection-and-disconnection.md"}},
  {"id":"network_002","type":"multi","category":"计算机网络","subCategory":"HTTP","stem":"以下哪些属于常见 2xx 状态码？","options":["200","201","204","404"],"answers":["200","201","204"],"explanation":"404 属于客户端错误。","difficulty":1,"tags":["HTTP"],"source":{"repo":"Snailclimb/JavaGuide","path":"docs/cs-basics/network/http-status-codes.md"}},
  {"id":"os_001","type":"single","category":"操作系统","subCategory":"进程线程","stem":"线程相比进程，通常哪项开销更小？","options":["创建与切换","地址空间分配","文件系统初始化","网络连接建立"],"answers":["创建与切换"],"explanation":"线程共享进程资源，切换开销通常更小。","difficulty":1,"tags":["线程"],"source":{"repo":"Snailclimb/JavaGuide","path":"docs/cs-basics/operating-system/operating-system-basic-questions-01.md"}},
  {"id":"design_001","type":"single","category":"系统设计","subCategory":"缓存","stem":"缓存击穿常见缓解方案是？","options":["随机删除缓存","互斥锁/单飞","关闭缓存","强制全量刷新"],"answers":["互斥锁/单飞"],"explanation":"热点 key 过期时可通过互斥请求回源避免击穿。","difficulty":3,"tags":["缓存"],"source":{"repo":"Snailclimb/JavaGuide","path":"docs/database/redis/3-commonly-used-cache-read-and-write-strategies.md"}}
]
